debate_media,coverage_media,channel,network,location,channel_type,program,coverage_time_utc,debate_start_second,coverage_start_second,duration,match_url,transcript
KQED_20161020_010000_PBS_NewsHour_Debates_2016_A_Special_Report,FBC_20161020_130000_Varney__Company,FBC,"FOX Business",SF/Oakland/SJ,cable,Varney__Company,"10/20/2016 15:02:44",4000,7364.8,25.7,https://archive.org/details/FBC_20161020_130000_Varney__Company#start/7364.8/end/7390.5,"TODAY, YOUR DAUGHTER WE VANG COULD SAID THE SAME THING. I WOULDN'T ASK YOU HERE ON THIS STAGE TONIGHT, DO YOU MAKE THE SAME COMMITMENT THAT YOU WILL ABSOLUTELY, SIR, THAT YOU WILL ABSOLUTELY ACCEPT THE RESULT OF THIS ELECTION. >> I WILL LOOK AT IT AT THE TIME. I'M NOT LOOKING AT ANYTHING NOW. I'LL LOOK AT IT AT THE TIME. WHAT I'VE SEEN, WHAT I'VE SEEN IS SO BAD. FIRST OF ALL THE MEDIA IS SO DISHONEST AND SO CORRUPT AND PIE ON SO AMAZING ARE ""NEW YORK"
KQED_20161020_010000_PBS_NewsHour_Debates_2016_A_Special_Report,FBC_20161020_130000_Varney__Company,FBC,"FOX Business",SF/Oakland/SJ,cable,Varney__Company,"10/20/2016 14:40:36",4063.1,6036.9,4,https://archive.org/details/FBC_20161020_130000_Varney__Company#start/6036.9/end/6040.9,"ONE OTHER THING. SHE SHOULDN'T BE ALLOWED TO RUN."
KQED_20161020_010000_PBS_NewsHour_Debates_2016_A_Special_Report,FBC_20161020_130000_Varney__Company,FBC,"FOX Business",SF/Oakland/SJ,cable,Varney__Company,"10/20/2016 15:33:16",4064.8,9196.2,48,https://archive.org/details/FBC_20161020_130000_Varney__Company#start/9196.2/end/9244.2,"ONE OTHER THING. SHE SHOULDN'T BE ALLOWED TO RUN. IT'S CROOKED. SHE'S GUILTY OF VERY SERIOUS CRIME. SHE SHOULD NOT BE ALLOWED TO RUN. AND JUST IN THAT RESPECT I SAY IT'S RIGGED. BECAUSE SHE SHOULD NEVER -- CHRIS, SHE SHOULD NEVER HAVE BEEN ALLOWED TO RUN FOR THE PRESIDENCY BASED ON WHAT SHE DID WITH E-MAILS AND SO MANY OTHER THINGS. >> BUT SIR THERE IS TRADITION IN THIS COUNTRY IN FACT ONE OF THE PRIDES OF THIS COUNTRY IS THAT PEACEFUL TRANSITION OF POWER AND THAT NO MATTER HOW HARD FOUGHT A CAMPAIGN IS THAT THE END OF THE CAMPAIGN, THAT THE LOSER CONCEDES TO THE WINNER, NOT SAYING THAT YOU'RE NECESSARILY GOING TO BE THE LOSER OR THE WINNER. BUILT THAT THE LOSER CONCEDES TO THE WINNER AND THAT THE COUNTRY COMES TOGETHER IN PART FOR THE GOOD OF THE COUNTRY. ARE YOU SAYING YOU'RE NOT"
KQED_20161020_010000_PBS_NewsHour_Debates_2016_A_Special_Report,FBC_20161020_130000_Varney__Company,FBC,"FOX Business",SF/Oakland/SJ,cable,Varney__Company,"10/20/2016 14:26:47",4151.3,5207.3,5.5,https://archive.org/details/FBC_20161020_130000_Varney__Company#start/5207.3/end/5212.8,"HIM. THERE WAS EVEN A TIME WHEN HE"
KQED_20161020_010000_PBS_NewsHour_Debates_2016_A_Special_Report,FBC_20161020_130000_Varney__Company,FBC,"FOX Business",SF/Oakland/SJ,cable,Varney__Company,"10/20/2016 14:45:03",4787.2,6303.7,3.2,https://archive.org/details/FBC_20161020_130000_Varney__Company#start/6303.7/end/6306.9,"ANY STANDPOINT, WHAT DO YOU NEED A SIGNED DOCUMENT?"
KQED_20161020_010000_PBS_NewsHour_Debates_2016_A_Special_Report,FBC_20161020_130000_Varney__Company,FBC,"FOX Business",SF/Oakland/SJ,cable,Varney__Company,"10/20/2016 14:45:10",4864.8,6310,2.3,https://archive.org/details/FBC_20161020_130000_Varney__Company#start/6310/end/6312.3,"WORSE THAN ASSAD."
KQED_20161020_010000_PBS_NewsHour_Debates_2016_A_Special_Report,FBC_20161020_130000_Varney__Company,FBC,"FOX Business",SF/Oakland/SJ,cable,Varney__Company,"10/20/2016 14:13:50",4885.6,4430.9,6.8,https://archive.org/details/FBC_20161020_130000_Varney__Company#start/4430.9/end/4437.7,">> LET LET ME. >> ISIS ALIGNED WE NOW HAVE THEM IN OUR COUNTRY AND WAIT UNTIL YOU SEE WHERE THIS IS GOING TO BE THE GREAT TROJAN HORSE."
KQED_20161020_010000_PBS_NewsHour_Debates_2016_A_Special_Report,FBC_20161020_130000_Varney__Company,FBC,"FOX Business",SF/Oakland/SJ,cable,Varney__Company,"10/20/2016 14:17:24",4885.8,4644.9,7,https://archive.org/details/FBC_20161020_130000_Varney__Company#start/4644.9/end/4651.9,">> LET LET ME. >> ISIS ALIGNED WE NOW HAVE THEM IN OUR COUNTRY AND WAIT UNTIL YOU SEE WHERE THIS IS GOING TO BE THE GREAT TROJAN HORSE."
KQED_20161020_010000_PBS_NewsHour_Debates_2016_A_Special_Report,FBC_20161020_130000_Varney__Company,FBC,"FOX Business",SF/Oakland/SJ,cable,Varney__Company,"10/20/2016 14:17:33",4988.3,4653.4,7.8,https://archive.org/details/FBC_20161020_130000_Varney__Company#start/4653.4/end/4661.2,"MADE THESE CLAIMS REPEATEDLY. I AM NOT GOING TO LET ANYONE INTO THIS COUNTRY WHO IS NOT"
KQED_20161020_010000_PBS_NewsHour_Debates_2016_A_Special_Report,FBC_20161020_130000_Varney__Company,FBC,"FOX Business",SF/Oakland/SJ,cable,Varney__Company,"10/20/2016 15:06:57",5139.9,7617.4,27.4,https://archive.org/details/FBC_20161020_130000_Varney__Company#start/7617.4/end/7644.8,"YOU IGNORING THIS PROBLEM, MR. TRUMP GO YOU FIRST. >> THEY'RE WRONG BECAUSE I'M GOING TO CREATE TREMENDOUS JOBS. WE ARE BRINGING GDP FROM REALLY SHE GOT IN IT WOULD BE LESS THAN ZERO. BUT WE'RE BRINGING IT FROM 1% UP TO 4% AND I ACTUALLY THINK WE CAN GO FIRE THAN 4%. I THINK YOU CAN GO TO 5 OR 6%. AND IF WE DO YOU DON'T HAVE TO BOTHER ASKING ME A QUESTION BECAUSE WE HAVE A TREMENDOUS"
KQED_20161020_010000_PBS_NewsHour_Debates_2016_A_Special_Report,FBC_20161020_130000_Varney__Company,FBC,"FOX Business",SF/Oakland/SJ,cable,Varney__Company,"10/20/2016 13:08:24",5535.5,504.1,7,https://archive.org/details/FBC_20161020_130000_Varney__Company#start/504.1/end/511.1,"COMMITMENT TO RAISE TAXES ON THE WEALTHY. MY SOCIAL SECURITY PAYROLL CONTRIBUTION WILL GO UP AS WILL"
KQED_20161020_010000_PBS_NewsHour_Debates_2016_A_Special_Report,FBC_20161020_130000_Varney__Company,FBC,"FOX Business",SF/Oakland/SJ,cable,Varney__Company,"10/20/2016 14:35:02",5535.5,5702.2,7.6,https://archive.org/details/FBC_20161020_130000_Varney__Company#start/5702.2/end/5709.8,"COMMITMENT TO RAISE TAXES ON THE WEALTHY. MY SOCIAL SECURITY PAYROLL CONTRIBUTION WILL GO UP AS WILL"
KQED_20161020_010000_PBS_NewsHour_Debates_2016_A_Special_Report,FBC_20161020_130000_Varney__Company,FBC,"FOX Business",SF/Oakland/SJ,cable,Varney__Company,"10/20/2016 15:02:57",5760.7,7377.3,10.400000000001,https://archive.org/details/FBC_20161020_130000_Varney__Company#start/7377.3/end/7387.7,"COME BACK, SEE YOU IN FOUR YEARS. WE ARE GOING TO MAKE AMERICA STRONG AGAIN AND WE ARE GOING TO MAKE AMERICA GREAT AGAIN AND IT HAS TO START NOW. WE CANNOT TAKE FOUR MORE YEARS"
KQED_20161020_010000_PBS_NewsHour_Debates_2016_A_Special_Report,CNNW_20161020_170000_Wolf,CNNW,CNN,SF/Oakland/SJ,cable,Wolf,"10/20/2016 17:19:19",523.1,1159.5,5.2,https://archive.org/details/CNNW_20161020_170000_Wolf#start/1159.5/end/1164.7,"SHOULD NEVER, EVER HAVE BEEN MADE. WE NEED A SUPREME COURT THAT IN MY OPINION IS GOING TO UPHOLD"
KQED_20161020_010000_PBS_NewsHour_Debates_2016_A_Special_Report,CNNW_20161020_170000_Wolf,CNNW,CNN,SF/Oakland/SJ,cable,Wolf,"10/20/2016 17:19:26",649.3,1166.9,9.7,https://archive.org/details/CNNW_20161020_170000_Wolf#start/1166.9/end/1176.6,"WONDERFUL YEARS, I REPRESENTED UPSTATE NEW YORK, I UNDERSTAND AND RESPECT THE TRADITION OF GUN OWNERSHIP. IT GOES BACK TO THE FOUNDING OF OUR COUNTRY."
KQED_20161020_010000_PBS_NewsHour_Debates_2016_A_Special_Report,CNNW_20161020_170000_Wolf,CNNW,CNN,SF/Oakland/SJ,cable,Wolf,"10/20/2016 17:19:39",942,1179.6,11.9,https://archive.org/details/CNNW_20161020_170000_Wolf#start/1179.6/end/1191.5,"YOU JUST SAID YOU WANT TO SEE THE COURT PROTECT THE 2nd AMENDMENT, DO YOU WANT TO SEE THE COURT OVERTURN -- >> IF WE PUT ANOTHER TWO OR PERHAPS THREE JUSTICES ON THAT'S REALLY WHAT IS GOING -- THAT'S"
KQED_20161020_010000_PBS_NewsHour_Debates_2016_A_Special_Report,CNNW_20161020_170000_Wolf,CNNW,CNN,SF/Oakland/SJ,cable,Wolf,"10/20/2016 17:32:38",1122.5,1958.1,15.3,https://archive.org/details/CNNW_20161020_170000_Wolf#start/1958.1/end/1973.4,"LATE-TERM PER SHALL BIRTH -- >> I THINK IT'S TERRIBLE IF YOU GO WITH WHAT HILLARY IS SAYING IN THE 9th MONTH YOU CAN TAKE THE BABY AND RIP THE BABY OUT OF THE WOMB OF THE MOTHER JUST PRIOR TO THE BIRTH OF THE BABY."
KQED_20161020_010000_PBS_NewsHour_Debates_2016_A_Special_Report,CNNW_20161020_170000_Wolf,CNNW,CNN,SF/Oakland/SJ,cable,Wolf,"10/20/2016 17:20:06",1338.3,1206.3,16.1,https://archive.org/details/CNNW_20161020_170000_Wolf#start/1206.3/end/1222.4,"CASH. WE NEED STRONG BORDERS WE NEED ABSOLUTE -- WE CANNOT GIVE AMNESTY. NOW, I WANT TO BUILD A WALL. WE NEED THE WALL. BORDER PATROL, ICE, ALL WANT THE WALL. WE STOP THE DRUGS, WE SHORE UP THE BORDER. ONE OF MY FIRST ACTS WILL TO BE"
KQED_20161020_010000_PBS_NewsHour_Debates_2016_A_Special_Report,CNNW_20161020_170000_Wolf,CNNW,CNN,SF/Oakland/SJ,cable,Wolf,"10/20/2016 17:08:58",1475.6,538.7,6.5,https://archive.org/details/CNNW_20161020_170000_Wolf#start/538.7/end/545.2,"PERSON, ANYBODY WHO SHOULD BE DEPORTED WE SHOULD DEPORT THEM. WHEN IT COMES TO THE WALL THAT DONALD TALKS ABOUT BUILDING, HE"
KQED_20161020_010000_PBS_NewsHour_Debates_2016_A_Special_Report,CNNW_20161020_170000_Wolf,CNNW,CNN,SF/Oakland/SJ,cable,Wolf,"10/20/2016 17:19:54",1604,1194.6,9.1,https://archive.org/details/CNNW_20161020_170000_Wolf#start/1194.6/end/1203.7,"EMPLOYERS DO YOU COMPLAIN I'LL GET YOU DEPORTED. I WANT TO GET EVERYBODY OUT OF THE SHADOWS, GET THE ECONOMY WORKING, NOT LET EMPLOYERS LIKE"
KQED_20161020_010000_PBS_NewsHour_Debates_2016_A_Special_Report,CNNW_20161020_170000_Wolf,CNNW,CNN,SF/Oakland/SJ,cable,Wolf,"10/20/2016 17:20:25",1604,1225.7,9.1,https://archive.org/details/CNNW_20161020_170000_Wolf#start/1225.7/end/1234.8,"EMPLOYERS DO YOU COMPLAIN I'LL GET YOU DEPORTED. I WANT TO GET EVERYBODY OUT OF THE SHADOWS, GET THE ECONOMY WORKING, NOT LET EMPLOYERS LIKE"
KQED_20161020_010000_PBS_NewsHour_Debates_2016_A_Special_Report,CNNW_20161020_170000_Wolf,CNNW,CNN,SF/Oakland/SJ,cable,Wolf,"10/20/2016 17:30:50",1714.9,1850,31,https://archive.org/details/CNNW_20161020_170000_Wolf#start/1850/end/1881,">> THAT'S THE QUESTION. PLEASE QUIET EVERYBODY. IS THAT YOUR DREAM, OPEN BORDERS? >> WELL, IF YOU WENT TON READ THE REST OF THE SENTENCE I WAS TALKING ABOUT ENERGY. WE TRADE MORE ENERGY WITH OUR NEIGHBORS THAN WE TRADE WITH THE REST OF THE WORLD COMBINED. I DO WANT US TO HAVE AN ELECTRIC GRID, AN ENERGY SYSTEM THAT CROSSES BORDERS, I THINK THAT WILL BE GREAT BENEFIT TO US. BUT, YOU ARE VERY CLEARLY QUOTING FROM WIKILEAKS WHAT IS REALLY IMPORTANT ABOUT"
KQED_20161020_010000_PBS_NewsHour_Debates_2016_A_Special_Report,CNNW_20161020_170000_Wolf,CNNW,CNN,SF/Oakland/SJ,cable,Wolf,"10/20/2016 17:31:23",1805.7,1883.4,4.5,https://archive.org/details/CNNW_20161020_170000_Wolf#start/1883.4/end/1887.9,"ANSWERED. WE'VE NEVER HAD ANYTHING LIKE THIS HAPPEN IN ANY OF OUR ELECTIONS BEFORE. >> THAT WAS A GREAT PIVOT OFF"
KQED_20161020_010000_PBS_NewsHour_Debates_2016_A_Special_Report,CNNW_20161020_170000_Wolf,CNNW,CNN,SF/Oakland/SJ,cable,Wolf,"10/20/2016 17:09:09",1889,549.9,5,https://archive.org/details/CNNW_20161020_170000_Wolf#start/549.9/end/554.9,"SEE HAVE 240 RESPECT FOR THIS PERSON. >> THAT'S BECAUSE HE'D RATHER"
KQED_20161020_010000_PBS_NewsHour_Debates_2016_A_Special_Report,CNNW_20161020_170000_Wolf,CNNW,CNN,SF/Oakland/SJ,cable,Wolf,"10/20/2016 17:20:37",2274.3,1237.8,10.8,https://archive.org/details/CNNW_20161020_170000_Wolf#start/1237.8/end/1248.6,"TO CREATE NEW OPPORTUNITIES AND NEW BUSINESSES. I WANT US TO DO MORE TO HELP SMALL BUSINESS, THAT'S WHERE TWO-THIRDS OF THE NEW JOBS ARE GOING TO COME FROM. I WANT US TO RAISE THE NATIONAL"
KQED_20161020_010000_PBS_NewsHour_Debates_2016_A_Special_Report,CNNW_20161020_170000_Wolf,CNNW,CNN,SF/Oakland/SJ,cable,Wolf,"10/20/2016 17:20:54",2473.4,1254.8,3.5,https://archive.org/details/CNNW_20161020_170000_Wolf#start/1254.8/end/1258.3,"DOUBLED OUR NATIONAL DEBT. WE'RE UP TO $20 TRILLION."
KQED_20161020_010000_PBS_NewsHour_Debates_2016_A_Special_Report,CNNW_20161020_170000_Wolf,CNNW,CNN,SF/Oakland/SJ,cable,Wolf,"10/20/2016 17:09:33",3040.9,573.3,4.1,https://archive.org/details/CNNW_20161020_170000_Wolf#start/573.3/end/577.4,"HER AN EATING MACHINE. ON THE DAY WHEN I WAS IN THE"
KQED_20161020_010000_PBS_NewsHour_Debates_2016_A_Special_Report,CNNW_20161020_170000_Wolf,CNNW,CNN,SF/Oakland/SJ,cable,Wolf,"10/20/2016 17:09:17",3316.6,557,2.2,https://archive.org/details/CNNW_20161020_170000_Wolf#start/557/end/559.2,"CALLED HER DISGUSTING AS HE HAS CALLED A NUMBER OF WOMEN DURING"
KQED_20161020_010000_PBS_NewsHour_Debates_2016_A_Special_Report,CNNW_20161020_170000_Wolf,CNNW,CNN,SF/Oakland/SJ,cable,Wolf,"10/20/2016 17:09:56",4112.3,596.8,3.5,https://archive.org/details/CNNW_20161020_170000_Wolf#start/596.8/end/600.3,"PREPARED NOW TO -- >> WHAT I'M SAYING THAT I WILL"
KQED_20161020_010000_PBS_NewsHour_Debates_2016_A_Special_Report,CNNW_20161020_170000_Wolf,CNNW,CNN,SF/Oakland/SJ,cable,Wolf,"10/20/2016 17:15:07",4454.1,907,6.9,https://archive.org/details/CNNW_20161020_170000_Wolf#start/907/end/913.9,"ALL SHE HAD TO DO WAS SAY THATth NOW WE'RE GOING IN AGAIN. YOU KNOW WHAT THE BIG WINNER IN MOSUL IS GOING TO BE AFTER WE"
KQED_20161020_010000_PBS_NewsHour_Debates_2016_A_Special_Report,CNNW_20161020_170000_Wolf,CNNW,CNN,SF/Oakland/SJ,cable,Wolf,"10/20/2016 17:43:25",4872.6,2605.2,20.5,https://archive.org/details/CNNW_20161020_170000_Wolf#start/2605.2/end/2625.7,"AND THIS IS WHAT'S CAUSED THE GREAT MIGRATION WHERE SHE'S TAKING IN TENS OF THOUSANDS OF SYRIAN REFUGEES WHO PROBABLY, IN MANY CASES -- NOT PROBABLY, WHO ARE DEFINITELY -- >> LET LET ME. >> ISIS ALIGNED WE NOW HAVE THEM IN OUR COUNTRY AND WAIT UNTIL YOU SEE WHERE THIS IS GOING TO BE THE GREAT TROJAN HORSE."
KQED_20161020_010000_PBS_NewsHour_Debates_2016_A_Special_Report,CNNW_20161020_170000_Wolf,CNNW,CNN,SF/Oakland/SJ,cable,Wolf,"10/20/2016 17:09:40",5535,580.9,7.9,https://archive.org/details/CNNW_20161020_170000_Wolf#start/580.9/end/588.8,"COMMITMENT TO RAISE TAXES ON THE WEALTHY. MY SOCIAL SECURITY PAYROLL CONTRIBUTION WILL GO UP AS WILL"
KQED_20161020_010000_PBS_NewsHour_Debates_2016_A_Special_Report,BLOOMBERG_20161020_210000_With_All_Due_Respect,BLOOMBERG,Bloomberg,SF/Oakland/SJ,cable,With_All_Due_Respect,"10/20/2016 21:14:35",558.5,875.1,16,https://archive.org/details/BLOOMBERG_20161020_210000_With_All_Due_Respect#start/875.1/end/891.1,"JUSTICES THAT I AM GOING TO APPOINT, THAT I NAMED 20 OF THEM, THE JUSTICES THAT I'M GOING TO APPOINT WILL BE PRO RIGHTS, THEY WILL HAVE CONSERVATIVE BENT, THEY WILL BE PROTECTING THE 2nd AMENDMENT THEY ARE GREAT SCHOLARS IN ALL CASES AND THEY ARE PEOPLE OF"
KQED_20161020_010000_PBS_NewsHour_Debates_2016_A_Special_Report,BLOOMBERG_20161020_210000_With_All_Due_Respect,BLOOMBERG,Bloomberg,SF/Oakland/SJ,cable,With_All_Due_Respect,"10/20/2016 21:14:59",754.4,899.2,12.1,https://archive.org/details/BLOOMBERG_20161020_210000_With_All_Due_Respect#start/899.2/end/911.3,"SHE SUPPORTS A 2nd AMENDMENT RIGHT TO BEAR LAWS. >> THE DC VERSUS TELLER DEVISION WAS VERY STRONGLY AND SHE WAS EXTREMELY ANGRY ABOUT IT. I WATCHED. SHE WAS VERY, VERY ANGRY WHEN"
KQED_20161020_010000_PBS_NewsHour_Debates_2016_A_Special_Report,BLOOMBERG_20161020_210000_With_All_Due_Respect,BLOOMBERG,Bloomberg,SF/Oakland/SJ,cable,With_All_Due_Respect,"10/20/2016 21:16:10",1479.6,970.3,2.2,https://archive.org/details/BLOOMBERG_20161020_210000_With_All_Due_Respect#start/970.3/end/972.5,"WHEN IT COMES TO THE WALL THAT"
KQED_20161020_010000_PBS_NewsHour_Debates_2016_A_Special_Report,BLOOMBERG_20161020_210000_With_All_Due_Respect,BLOOMBERG,Bloomberg,SF/Oakland/SJ,cable,With_All_Due_Respect,"10/20/2016 21:18:36",1698.5,1116,32.7,https://archive.org/details/BLOOMBERG_20161020_210000_With_All_Due_Respect#start/1116/end/1148.7,"YOU WERE PAID $225,000 WE'VE LEARNED FROM THE WIKILEAK, IS THAT YOU SAID THIS. I WANT TO QUOTE. MY DREAM IS A HEMISPHERE RICK COMMON MARKET WITH OPEN TRADE AND OPEN BORDERS. >> THANK YOU. >> THAT'S THE QUESTION. PLEASE QUIET EVERYBODY. IS THAT YOUR DREAM, OPEN BORDERS? >> WELL, IF YOU WENT TON READ THE REST OF THE SENTENCE I WAS TALKING ABOUT ENERGY. WE TRADE MORE ENERGY WITH OUR NEIGHBORS THAN WE TRADE WITH THE REST OF THE WORLD COMBINED. I DO WANT US TO HAVE AN ELECTRIC"
KQED_20161020_010000_PBS_NewsHour_Debates_2016_A_Special_Report,BLOOMBERG_20161020_210000_With_All_Due_Respect,BLOOMBERG,Bloomberg,SF/Oakland/SJ,cable,With_All_Due_Respect,"10/20/2016 21:18:54",1775.4,1134,8.4,https://archive.org/details/BLOOMBERG_20161020_210000_With_All_Due_Respect#start/1134/end/1142.4,"INTELLIGENCE AGENCIES HAVE CONFIRMED TO INFLUENCE OUR ELECTION. I ACTUALLY THINK THE MOST IMPORTANT QUESTION OF THIS"
KQED_20161020_010000_PBS_NewsHour_Debates_2016_A_Special_Report,BLOOMBERG_20161020_210000_With_All_Due_Respect,BLOOMBERG,Bloomberg,SF/Oakland/SJ,cable,With_All_Due_Respect,"10/20/2016 21:16:15",1884.1,975.5,4.4,https://archive.org/details/BLOOMBERG_20161020_210000_With_All_Due_Respect#start/975.5/end/979.9,"PLAYING CHICKEN. LOOK PUTIN FROM EVERYTHING I"
KQED_20161020_010000_PBS_NewsHour_Debates_2016_A_Special_Report,BLOOMBERG_20161020_210000_With_All_Due_Respect,BLOOMBERG,Bloomberg,SF/Oakland/SJ,cable,With_All_Due_Respect,"10/20/2016 21:16:46",2903.7,1006.2,4.4,https://archive.org/details/BLOOMBERG_20161020_210000_With_All_Due_Respect#start/1006.2/end/1010.6,"AND ALUMINUM, THE TRUMP HOTEL RIGHT HERE IN LAS VEGAS WAS MADE WITH CHINESE STEEL."
KQED_20161020_010000_PBS_NewsHour_Debates_2016_A_Special_Report,BLOOMBERG_20161020_210000_With_All_Due_Respect,BLOOMBERG,Bloomberg,SF/Oakland/SJ,cable,With_All_Due_Respect,"10/20/2016 21:16:52",3023.7,1012.6,2.5,https://archive.org/details/BLOOMBERG_20161020_210000_With_All_Due_Respect#start/1012.6/end/1015.1,"BUILDINGS. IN THE 1980s, I WAS WORKING TO REFORM SCHOOLS IN ARKANSAS."
KQED_20161020_010000_PBS_NewsHour_Debates_2016_A_Special_Report,BLOOMBERG_20161020_210000_With_All_Due_Respect,BLOOMBERG,Bloomberg,SF/Oakland/SJ,cable,With_All_Due_Respect,"10/20/2016 21:19:05",3625.3,1145,21.5,https://archive.org/details/BLOOMBERG_20161020_210000_With_All_Due_Respect#start/1145/end/1166.5,"SAY THAT YOU KEPT YOUR PLEDGE TO THAT SENATE COMMITTEE WHY ISN'T WHAT HAPPENED AND WHAT WENT ON BETWEEN YOU AND THE CLINTON FOUNDATION, WHY ISN'T IT WHAT MR. TRUMP CALLS, PAY TO PLAY. >> WELL, EVERYTHING I DID AS SECRETARY OF STATE WAS FURTHERANCE OF OUR COUNTRY'S INTERESTS AND OUR VALUES. STATE DEPARTMENT HAS SAID THAT,"
KQED_20161020_010000_PBS_NewsHour_Debates_2016_A_Special_Report,BLOOMBERG_20161020_210000_With_All_Due_Respect,BLOOMBERG,Bloomberg,SF/Oakland/SJ,cable,With_All_Due_Respect,"10/20/2016 21:19:33",3663,1173.7,28.6,https://archive.org/details/BLOOMBERG_20161020_210000_With_All_Due_Respect#start/1173.7/end/1202.3,"BRIEFLY, THE CLINTON FOUNDATION MADE IT POSSIBLE FOR 11 MILLION PEOPLE AROUND THE WORLD WITH HIV AIDS TO AFFORD TREATMENT. THAT'S ABOUT HALF OF ALL THE PEOPLE IN THE WORLD WHO ARE GETTING TREATMENT. IN PARTNERSHIP WITH THE AMERICAN -- >> SECRETARY CLINTON -- WITH THE HEALTH ASSOCIATION WE'VE MADE ENVIRONMENTS IN SCHOOLS -- >> SECRETARY CLINTON -- RESPECTFULLY THIS IS AN OPEN DISCUSSION -- >> IT IS AN OPEN DISCUSSION. >> SPECIFIC QUESTION TO PAY FOR PRAY. >> IT'S BEEN VERY WELL --"
KQED_20161020_010000_PBS_NewsHour_Debates_2016_A_Special_Report,BLOOMBERG_20161020_210000_With_All_Due_Respect,BLOOMBERG,Bloomberg,SF/Oakland/SJ,cable,With_All_Due_Respect,"10/20/2016 21:16:57",3767.5,1017.2,6.2,https://archive.org/details/BLOOMBERG_20161020_210000_With_All_Due_Respect#start/1017.2/end/1023.4,"WATCH DOGS THAT FOLLOW FOUNDATION. I'D BE HAPPY TO COMPARE WHAT WE DO WITH THE TRUMP FOUNDATION,"
KQED_20161020_010000_PBS_NewsHour_Debates_2016_A_Special_Report,BLOOMBERG_20161020_210000_With_All_Due_Respect,BLOOMBERG,Bloomberg,SF/Oakland/SJ,cable,With_All_Due_Respect,"10/20/2016 21:17:05",3942.9,1025.3,6.2,https://archive.org/details/BLOOMBERG_20161020_210000_With_All_Due_Respect#start/1025.3/end/1031.5,"BUT YOU WON'T CHANGE THE LAW BECAUSE YOU'VE TAKEN SO MUCH MONEY. I SAT IN MY APARTMENT TODAY ON"
KQED_20161020_010000_PBS_NewsHour_Debates_2016_A_Special_Report,BLOOMBERG_20161020_210000_With_All_Due_Respect,BLOOMBERG,Bloomberg,SF/Oakland/SJ,cable,With_All_Due_Respect,"10/20/2016 21:13:34",3999.9,814,8.5,https://archive.org/details/BLOOMBERG_20161020_210000_With_All_Due_Respect#start/814/end/822.5,"TODAY, YOUR DAUGHTER WE VANG COULD SAID THE SAME THING. I WOULDN'T ASK YOU HERE ON THIS STAGE TONIGHT, DO YOU MAKE THE SAME COMMITMENT THAT YOU WILL ABSOLUTELY, SIR, THAT YOU WILL"
KQED_20161020_010000_PBS_NewsHour_Debates_2016_A_Special_Report,BLOOMBERG_20161020_210000_With_All_Due_Respect,BLOOMBERG,Bloomberg,SF/Oakland/SJ,cable,With_All_Due_Respect,"10/20/2016 21:13:45",4087,825.1,5.5,https://archive.org/details/BLOOMBERG_20161020_210000_With_All_Due_Respect#start/825.1/end/830.6,"WITH E-MAILS AND SO MANY OTHER THINGS. >> BUT SIR THERE IS TRADITION IN THIS COUNTRY IN FACT ONE OF THE PRIDES OF THIS COUNTRY IS"
KQED_20161020_010000_PBS_NewsHour_Debates_2016_A_Special_Report,BLOOMBERG_20161020_210000_With_All_Due_Respect,BLOOMBERG,Bloomberg,SF/Oakland/SJ,cable,With_All_Due_Respect,"10/20/2016 21:13:56",4107.4,836.3,5,https://archive.org/details/BLOOMBERG_20161020_210000_With_All_Due_Respect#start/836.3/end/841.3,"COMES TOGETHER IN PART FOR THE GOOD OF THE COUNTRY. ARE YOU SAYING YOU'RE NOT"
KQED_20161020_010000_PBS_NewsHour_Debates_2016_A_Special_Report,BLOOMBERG_20161020_210000_With_All_Due_Respect,BLOOMBERG,Bloomberg,SF/Oakland/SJ,cable,With_All_Due_Respect,"10/20/2016 21:17:12",4151.3,1032.2,4.4,https://archive.org/details/BLOOMBERG_20161020_210000_With_All_Due_Respect#start/1032.2/end/1036.6,"HIM. THERE WAS EVEN A TIME WHEN HE"
KQED_20161020_010000_PBS_NewsHour_Debates_2016_A_Special_Report,BLOOMBERG_20161020_210000_With_All_Due_Respect,BLOOMBERG,Bloomberg,SF/Oakland/SJ,cable,With_All_Due_Respect,"10/20/2016 21:17:19",4188.6,1039.6,2.5,https://archive.org/details/BLOOMBERG_20161020_210000_With_All_Due_Respect#start/1039.6/end/1042.1,"ELECTION. PRESIDENT OBAMA SAID THE OTHER"
KQED_20161020_010000_PBS_NewsHour_Debates_2016_A_Special_Report,BLOOMBERG_20161020_210000_With_All_Due_Respect,BLOOMBERG,Bloomberg,SF/Oakland/SJ,cable,With_All_Due_Respect,"10/20/2016 21:17:32",5535,1052.8,9.3,https://archive.org/details/BLOOMBERG_20161020_210000_With_All_Due_Respect#start/1052.8/end/1062.1,"COMMITMENT TO RAISE TAXES ON THE WEALTHY. MY SOCIAL SECURITY PAYROLL CONTRIBUTION WILL GO UP AS WILL DONALD'S ASSUMING HE CAN'T"
KQED_20161020_010000_PBS_NewsHour_Debates_2016_A_Special_Report,MSNBCW_20161020_140000_MSNBC_Live,MSNBCW,MSNBC,SF/Oakland/SJ,cable,MSNBC_Live,"10/20/2016 14:36:27",558.5,2187,6.4,https://archive.org/details/MSNBCW_20161020_140000_MSNBC_Live#start/2187/end/2193.4,"JUSTICES THAT I AM GOING TO APPOINT, THAT I NAMED 20 OF THEM, THE JUSTICES THAT I'M GOING TO APPOINT WILL BE PRO"
KQED_20161020_010000_PBS_NewsHour_Debates_2016_A_Special_Report,MSNBCW_20161020_140000_MSNBC_Live,MSNBCW,MSNBC,SF/Oakland/SJ,cable,MSNBC_Live,"10/20/2016 14:36:36",649.3,2196.1,9.7,https://archive.org/details/MSNBCW_20161020_140000_MSNBC_Live#start/2196.1/end/2205.8,"WONDERFUL YEARS, I REPRESENTED UPSTATE NEW YORK, I UNDERSTAND AND RESPECT THE TRADITION OF GUN OWNERSHIP. IT GOES BACK TO THE FOUNDING OF OUR COUNTRY."
KQED_20161020_010000_PBS_NewsHour_Debates_2016_A_Special_Report,MSNBCW_20161020_140000_MSNBC_Live,MSNBCW,MSNBC,SF/Oakland/SJ,cable,MSNBC_Live,"10/20/2016 14:00:29",1476.1,29.1,5.8,https://archive.org/details/MSNBCW_20161020_140000_MSNBC_Live#start/29.1/end/34.9,"PERSON, ANYBODY WHO SHOULD BE DEPORTED WE SHOULD DEPORT THEM. WHEN IT COMES TO THE WALL THAT"
KQED_20161020_010000_PBS_NewsHour_Debates_2016_A_Special_Report,MSNBCW_20161020_140000_MSNBC_Live,MSNBCW,MSNBC,SF/Oakland/SJ,cable,MSNBC_Live,"10/20/2016 14:20:39",1908.1,1239,14.3,https://archive.org/details/MSNBCW_20161020_140000_MSNBC_Live#start/1239/end/1253.3,"ENCOURAGE ESPYIANAGE AGAINST OUR PEOPLE THAT YOU ARE WILLING TO SPOUT THE PUTIN LINE, SIGN UP FOR HIS WISH LIST, RAKE UP NATO DO WHATEVER HE WANTS TO DO. AND THAT YOU CONTINUE TO GET"
KQED_20161020_010000_PBS_NewsHour_Debates_2016_A_Special_Report,MSNBCW_20161020_140000_MSNBC_Live,MSNBCW,MSNBC,SF/Oakland/SJ,cable,MSNBC_Live,"10/20/2016 14:47:18",1945.6,2838.2,19.9,https://archive.org/details/MSNBCW_20161020_140000_MSNBC_Live#start/2838.2/end/2858.1,"THESE ESPIONAGE ATTACKS, THESE CYBERATTACKS COME FROM THE HIGHEST LEVELS OF THE KREMLIN AND THEY ARE DESIGNED TO INFLUENCE OUR ELECTION. I FIND THAT DEEPLY DISTURBING. >> SECRETARY CLINTON -- I HIT IT'S -- SHE HAS NO IDEA WHETHER IT'S RUSHA CHINA -- >> I'M NOT QUOTING MYSELF I AM -- >> YOU HAVE NO IDEA."
KQED_20161020_010000_PBS_NewsHour_Debates_2016_A_Special_Report,MSNBCW_20161020_140000_MSNBC_Live,MSNBCW,MSNBC,SF/Oakland/SJ,cable,MSNBC_Live,"10/20/2016 14:13:50",2075.7,830.1,10.7,https://archive.org/details/MSNBCW_20161020_140000_MSNBC_Live#start/830.1/end/840.8,"RAISING NUCLEAR WEAPONS, THIS IS A PERSON WHO HAS BEEN VERY CAVALIER, EVEN CASUAL ABOUT THE USE OF NUCLEAR WEAPONS. HE'S ADVOCATED MORE COUNTRIES GETTING THEM JAPAN KOREA, EVEN"
KQED_20161020_010000_PBS_NewsHour_Debates_2016_A_Special_Report,MSNBCW_20161020_140000_MSNBC_Live,MSNBCW,MSNBC,SF/Oakland/SJ,cable,MSNBC_Live,"10/20/2016 14:38:03",2330.6,2283,6.9,https://archive.org/details/MSNBCW_20161020_140000_MSNBC_Live#start/2283/end/2289.9,"MOST OF THE GAINS IN THE LAST YEARS SINCE THE GREAT RESECTION HAVE GONE TO THE VERY TOP. WE ARE GOING TO HAVE THE WEALTHY"
KQED_20161020_010000_PBS_NewsHour_Debates_2016_A_Special_Report,MSNBCW_20161020_140000_MSNBC_Live,MSNBCW,MSNBC,SF/Oakland/SJ,cable,MSNBC_Live,"10/20/2016 14:46:06",2971.4,2766.3,9.3,https://archive.org/details/MSNBCW_20161020_140000_MSNBC_Live#start/2766.3/end/2775.6,"HILLARY. YOU DON'T. JUST LIKE WHEN YOU RAN THE STATE DEPARTMENT, $6 BILLION WAS MISSING. HOW DO YOU MISS $6 BILLION? U RAN THE STATE DEPARTMENT."
