debate_media,coverage_media,channel,network,location,channel_type,program,coverage_time_utc,debate_start_second,coverage_start_second,duration,match_url,transcript
KQED_20161020_010000_PBS_NewsHour_Debates_2016_A_Special_Report,MSNBCW_20161020_090000_First_Look,MSNBCW,MSNBC,SF/Oakland/SJ,cable,First_Look,"10/20/2016 09:13:23",4636.7,803.5,18.6,https://archive.org/details/MSNBCW_20161020_090000_First_Look#start/803.5/end/822.1,"I'M JUST AMAZED THAT HE SEEMS TO THINK THAT THE IRAQI GOVERNMENT AND OUR ALLIES AND EVERYBODY ELSE LAUNCHED THE ATTACK ON MOSUL TO HELP ME IN THIS ELECTION. BUT THAT'S HOW DONALD THINKS. HE ALWAYS -- LOOKING FOR SOME -- >> BECAUSE WE DON'T GAIN ANYTHING. IRAN IS MAKING --"
KQED_20161020_010000_PBS_NewsHour_Debates_2016_A_Special_Report,MSNBCW_20161020_090000_First_Look,MSNBCW,MSNBC,SF/Oakland/SJ,cable,First_Look,"10/20/2016 09:30:01",4664.4,1801.4,2,https://archive.org/details/MSNBCW_20161020_090000_First_Look#start/1801.4/end/1803.4,">> WOULD HAVE GAINED --"
KQED_20161020_010000_PBS_NewsHour_Debates_2016_A_Special_Report,MSNBCW_20161020_090000_First_Look,MSNBCW,MSNBC,SF/Oakland/SJ,cable,First_Look,"10/20/2016 09:30:05",4693.1,1805.1,8.8,https://archive.org/details/MSNBCW_20161020_090000_First_Look#start/1805.1/end/1813.9,"IF YOU THINK THAT WAS GOOD, THEN YOU DO. NOW, JOHN PODESTA SAID YOU HAVE TERRIBLE INSTINCTS."
KQED_20161020_010000_PBS_NewsHour_Debates_2016_A_Special_Report,MSNBCW_20161020_090000_First_Look,MSNBCW,MSNBC,SF/Oakland/SJ,cable,First_Look,"10/20/2016 09:10:52",4730.2,652.2,52.7,https://archive.org/details/MSNBCW_20161020_090000_First_Look#start/652.2/end/704.9,"ON THAT BECAUSE YOU SAID SEVERAL THINGS IN THAT DEBATE WHICH WERE NOT TRUE, SIR. YOU SAID THAT ALEPPO HAS BASICALLY FALLEN, IN FACT -- >> IT'S A CATASTROPHE. >> THERE ARE QUARTER -- HAVE YOU SEEN IT? >> SIR -- HAVE YOU SEEN WHAT'S HAPPENED TO -- >> CAN I FINISH MY QUESTION? >> IT HASN'T FALLEN, TAKE A LOOK AT IT. >> THERE ARE QUARTER OF MILLION PEOPLE STILL LIVING THERE. >> THEY ARE BEING SLAUGHTERED. >> YES. >> BECAUSE OF BAD DECISIONS. >> I MAY JUST FINISH HERE. YOU ALSO SAID THAT SYRIA AND RUSSIA ARE BUSY FIGHTING ISIS IN FACT THEY HAVE BEEN THE ONES WHO HAVE BEEN BOMBING AND SHELLING EASTERN ALEPPO AND THEY JUST ANNOUNCED HUMANITARIAN CAUSE IN EFFECT ADMITTING THAT THEY HAVE BEEN BOMBING AND -- >> YOU WOULD YOU LIKE TO CLEAR THAT UP. >> ALEPPO IS HUMANITARIAN"
KQED_20161020_010000_PBS_NewsHour_Debates_2016_A_Special_Report,MSNBCW_20161020_090000_First_Look,MSNBCW,MSNBC,SF/Oakland/SJ,cable,First_Look,"10/20/2016 09:12:01",4937.1,721.4,14.1,https://archive.org/details/MSNBCW_20161020_090000_First_Look#start/721.4/end/735.5,"DOING PRESIDENT CLINTON SHOOT THAT PLANE DOWN? >> FIRST OF ALL, I THINK A NO FLY ZONE COULD SAVE LIVES AND COULD HASTEN THE END OF THE CONFLICT. I AM WELL AWARE OF THE REALLY LEGITIMATE CONCERNS THAT YOU HAVE EXPRESSED FROM BOTH THE"
KQED_20161020_010000_PBS_NewsHour_Debates_2016_A_Special_Report,MSNBCW_20161020_090000_First_Look,MSNBCW,MSNBC,SF/Oakland/SJ,cable,First_Look,"10/20/2016 09:12:19",4970.7,739.4,4.7,https://archive.org/details/MSNBCW_20161020_090000_First_Look#start/739.4/end/744.1,"INSIDE SYRIA WHO HAVE BEEN DISLOCATED. SO I THINK WE COULD STRIKE A"
KQED_20161020_010000_PBS_NewsHour_Debates_2016_A_Special_Report,MSNBCW_20161020_090000_First_Look,MSNBCW,MSNBC,SF/Oakland/SJ,cable,First_Look,"10/20/2016 09:47:26",5362.8,2846.8,17.7,https://archive.org/details/MSNBCW_20161020_090000_First_Look#start/2846.8/end/2864.5,"YOU, I WANT TO INVEST IN YOUR FAMILY. I THINK THAT'S THE SMARTEST WAY TO GROW THE ECONOMY, TO MAKE THE ECONOMY FAIRER, WE JUST HAVE A BIG DISAGREEMENT ABOUT THIS. IT MAY BE BECAUSE OF OUR EXPERIENCES, YOU KNOW, HE STARTED OFF WITH HIS DAD AS A -- >> WE'VE HEARD THIS BEFORE"
KQED_20161020_010000_PBS_NewsHour_Debates_2016_A_Special_Report,MSNBCW_20161020_090000_First_Look,MSNBCW,MSNBC,SF/Oakland/SJ,cable,First_Look,"10/20/2016 09:38:19",5435.7,2299.7,25.7,https://archive.org/details/MSNBCW_20161020_090000_First_Look#start/2299.7/end/2325.4,"IS LET ME START WITH YOU MR. TRUMP, WOULD PRESIDENT TRUMP MAKE A DEAL TO SAVE MEDICARE AND SOCIAL SECURITY THAT INCLUDED BOTH TAX INCREASES AND BENEFIT CUTS IN EFFECT A GRAND BARGAIN ON ENTITLEMENTS? >> I'M CUTTING TAXES. WE'RE GOING TO GROW THE ECONOMY. IT'S GOING TO GROW -- >> THAT'S NOT THE -- GOING TO TOTALLY HELP YOU. >> REPEAL AND REPLACE THE"
KQED_20161020_010000_PBS_NewsHour_Debates_2016_A_Special_Report,MSNBCW_20161020_090000_First_Look,MSNBCW,MSNBC,SF/Oakland/SJ,cable,First_Look,"10/20/2016 09:38:54",5528.5,2334.1,14.599999999999,https://archive.org/details/MSNBCW_20161020_090000_First_Look#start/2334.1/end/2348.7,"AS SAYING THAT WE NEED TO PUT MORE MONEY INTO SOCIAL SECURITY TRUST FUND, THAT'S PART OF MY COMMITMENT TO RAISE TAXES ON THE WEALTHY. MY SOCIAL SECURITY PAYROLL CONTRIBUTION WILL GO UP AS WILL"
KQED_20161020_010000_PBS_NewsHour_Debates_2016_A_Special_Report,CNNW_20161020_063000_Debate_Night_in_America,CNNW,CNN,SF/Oakland/SJ,cable,Debate_Night_in_America,"10/20/2016 07:37:26",1014.5,4046,19.5,https://archive.org/details/CNNW_20161020_063000_Debate_Night_in_America#start/4046/end/4065.5,"PLANNED PARENTHOOD. I WILL DEFEND PLANNED PARENTHOOD. I WILL DEFEND ROE V. WADE AND DEFEND WOMEN'S RIGHTS TO MAKE THEIR OWN HEALTHCARE DECISIONS. WE HAVE COME TOO FAR TO HAVE THAT TURNED BACK NOW. INDEED HE SAID WOMEN SHOULD BE PUNISHED, THAT THERE SHOULD BE SOME FORM OF PUNISHMENT FOR"
KQED_20161020_010000_PBS_NewsHour_Debates_2016_A_Special_Report,CNNW_20161020_063000_Debate_Night_in_America,CNNW,CNN,SF/Oakland/SJ,cable,Debate_Night_in_America,"10/20/2016 07:08:06",1358.3,2286,9.3,https://archive.org/details/CNNW_20161020_063000_Debate_Night_in_America#start/2286/end/2295.3,"BAD, BAD PEOPLE IN THIS COUNTRY THAT HAVE TO GO OUT. WE'RE GOING TO GET THEM OUT WE'RE GOING TO SECURITY BORDER AND ONCE THE BORDER IS SECURED AT A LATER DATE MAKE"
KQED_20161020_010000_PBS_NewsHour_Debates_2016_A_Special_Report,CNNW_20161020_063000_Debate_Night_in_America,CNNW,CNN,SF/Oakland/SJ,cable,Debate_Night_in_America,"10/20/2016 07:49:59",1592.4,4799.8,9.2,https://archive.org/details/CNNW_20161020_063000_Debate_Night_in_America#start/4799.8/end/4809,"CAN'T EXPLOIT THEM AND UNDERCUT AMERICAN WAGES DONALD KNOWS A LOT ABOUT THIS HE USED UDOCUMENTED LABOR TO BUILD THE TRUMP TOWER. HE UNDERPAID UNDOCUMENTED"
KQED_20161020_010000_PBS_NewsHour_Debates_2016_A_Special_Report,CNNW_20161020_063000_Debate_Night_in_America,CNNW,CNN,SF/Oakland/SJ,cable,Debate_Night_in_America,"10/20/2016 07:35:25",1656,3925.6,9.3,https://archive.org/details/CNNW_20161020_063000_Debate_Night_in_America#start/3925.6/end/3934.9,"BECOME CITIZENS, VERY UNFAIR THAT SOMEBODY RUNS ACROSS THE BORDER, BECOMES A CITIZEN UNDER HER PLAN YOU HAVE OPEN BORDERS, YOU WOULD HAVE A DISASTER ON TRADE, YOU WILL HAVE A DISASTER WITH YOUR OPEN BOARDERS."
KQED_20161020_010000_PBS_NewsHour_Debates_2016_A_Special_Report,CNNW_20161020_063000_Debate_Night_in_America,CNNW,CNN,SF/Oakland/SJ,cable,Debate_Night_in_America,"10/20/2016 07:48:39",2074.3,4719.1,12.8,https://archive.org/details/CNNW_20161020_063000_Debate_Night_in_America#start/4719.1/end/4731.9,"RAISING NUCLEAR WEAPONS, THIS IS A PERSON WHO HAS BEEN VERY CAVALIER, EVEN CASUAL ABOUT THE USE OF NUCLEAR WEAPONS. HE'S ADVOCATED MORE COUNTRIES GETTING THEM JAPAN KOREA, EVEN"
KQED_20161020_010000_PBS_NewsHour_Debates_2016_A_Special_Report,CNNW_20161020_063000_Debate_Night_in_America,CNNW,CNN,SF/Oakland/SJ,cable,Debate_Night_in_America,"10/20/2016 07:48:56",2162.1,4736.4,3,https://archive.org/details/CNNW_20161020_063000_Debate_Night_in_America#start/4736.4/end/4739.4,"THIS IS JUST ANOTHER LIE."
KQED_20161020_010000_PBS_NewsHour_Debates_2016_A_Special_Report,CNNW_20161020_063000_Debate_Night_in_America,CNNW,CNN,SF/Oakland/SJ,cable,Debate_Night_in_America,"10/20/2016 07:58:30",4002.2,5310.4,4,https://archive.org/details/CNNW_20161020_063000_Debate_Night_in_America#start/5310.4/end/5314.4,"STAGE TONIGHT, DO YOU MAKE THE SAME COMMITMENT THAT YOU WILL"
KQED_20161020_010000_PBS_NewsHour_Debates_2016_A_Special_Report,CNNW_20161020_063000_Debate_Night_in_America,CNNW,CNN,SF/Oakland/SJ,cable,Debate_Night_in_America,"10/20/2016 06:42:53",4088.8,773.8,21.8,https://archive.org/details/CNNW_20161020_063000_Debate_Night_in_America#start/773.8/end/795.6,"IN THIS COUNTRY IN FACT ONE OF THE PRIDES OF THIS COUNTRY IS THAT PEACEFUL TRANSITION OF POWER AND THAT NO MATTER HOW HARD FOUGHT A CAMPAIGN IS THAT THE END OF THE CAMPAIGN, THAT THE LOSER CONCEDES TO THE WINNER, NOT SAYING THAT YOU'RE NECESSARILY GOING TO BE THE LOSER OR THE WINNER. BUILT THAT THE LOSER CONCEDES TO THE WINNER AND THAT THE COUNTRY COMES TOGETHER IN PART FOR THE"
KQED_20161020_010000_PBS_NewsHour_Debates_2016_A_Special_Report,CNNW_20161020_063000_Debate_Night_in_America,CNNW,CNN,SF/Oakland/SJ,cable,Debate_Night_in_America,"10/20/2016 07:59:21",4107.5,5361.8,4.9,https://archive.org/details/CNNW_20161020_063000_Debate_Night_in_America#start/5361.8/end/5366.7,"COMES TOGETHER IN PART FOR THE GOOD OF THE COUNTRY. ARE YOU SAYING YOU'RE NOT"
KQED_20161020_010000_PBS_NewsHour_Debates_2016_A_Special_Report,CNNW_20161020_063000_Debate_Night_in_America,CNNW,CNN,SF/Oakland/SJ,cable,Debate_Night_in_America,"10/20/2016 07:32:30",5534.4,3750.9,10,https://archive.org/details/CNNW_20161020_063000_Debate_Night_in_America#start/3750.9/end/3760.9,"COMMITMENT TO RAISE TAXES ON THE WEALTHY. MY SOCIAL SECURITY PAYROLL CONTRIBUTION WILL GO UP AS WILL DONALD'S ASSUMING HE CAN'T"
KQED_20161020_010000_PBS_NewsHour_Debates_2016_A_Special_Report,FOXNEWSW_20161020_220000_Special_Report_With_Bret_Baier,FOXNEWSW,"FOX News",SF/Oakland/SJ,cable,Special_Report_With_Bret_Baier,"10/20/2016 22:10:31",1014.5,631.3,4.9,https://archive.org/details/FOXNEWSW_20161020_220000_Special_Report_With_Bret_Baier#start/631.3/end/636.2,"PLANNED PARENTHOOD. I WILL DEFEND PLANNED PARENTHOOD."
KQED_20161020_010000_PBS_NewsHour_Debates_2016_A_Special_Report,FOXNEWSW_20161020_220000_Special_Report_With_Bret_Baier,FOXNEWSW,"FOX News",SF/Oakland/SJ,cable,Special_Report_With_Bret_Baier,"10/20/2016 22:10:37",1101.5,637.2,4.4,https://archive.org/details/FOXNEWSW_20161020_220000_Special_Report_With_Bret_Baier#start/637.2/end/641.6,"HAPPENED OR JUST BEEN DISCOVERED ABOUT THE PREGNANCY."
KQED_20161020_010000_PBS_NewsHour_Debates_2016_A_Special_Report,FOXNEWSW_20161020_220000_Special_Report_With_Bret_Baier,FOXNEWSW,"FOX News",SF/Oakland/SJ,cable,Special_Report_With_Bret_Baier,"10/20/2016 22:06:53",1141.7,413.6,10.3,https://archive.org/details/FOXNEWSW_20161020_220000_Special_Report_With_Bret_Baier#start/413.6/end/423.9,"THAT'S OKAY. BUT IT'S NOT OKAY WITH ME. BECAUSE BASED ON WHAT SHE IS SAYING BASED ON WHERE SHE'S GOING AND WHERE SHE'S BEEN, YOU CAN TAKE THE BABY AND RIP THE BABY OUT OF THE WOMB."
KQED_20161020_010000_PBS_NewsHour_Debates_2016_A_Special_Report,FOXNEWSW_20161020_220000_Special_Report_With_Bret_Baier,FOXNEWSW,"FOX News",SF/Oakland/SJ,cable,Special_Report_With_Bret_Baier,"10/20/2016 22:10:13",1885.2,613.9,10.8,https://archive.org/details/FOXNEWSW_20161020_220000_Special_Report_With_Bret_Baier#start/613.9/end/624.7,"PLAYING CHICKEN. LOOK PUTIN FROM EVERYTHING I SEE HAVE 240 RESPECT FOR THIS PERSON. >> THAT'S BECAUSE HE'D RATHER HAVE A PUPPET AS PRESIDENT. >> NO PUPPET."
KQED_20161020_010000_PBS_NewsHour_Debates_2016_A_Special_Report,FOXNEWSW_20161020_220000_Special_Report_With_Bret_Baier,FOXNEWSW,"FOX News",SF/Oakland/SJ,cable,Special_Report_With_Bret_Baier,"10/20/2016 22:11:12",2090.3,672.4,13.5,https://archive.org/details/FOXNEWSW_20161020_220000_Special_Report_With_Bret_Baier#start/672.4/end/685.9,"WHY DON'T WE USE THEM. WHICH I THINK IS TERRIFYING. BUT HERE IS THE DEAL. BOTTOM LINE ON NUCLEAR WEAPONS IS, THAT WHEN THE PRESIDENT GIVES THE ORDER IT MUST BE FOLLOWED. THERE'S ABOUT FOUR MINUTES"
KQED_20161020_010000_PBS_NewsHour_Debates_2016_A_Special_Report,FOXNEWSW_20161020_220000_Special_Report_With_Bret_Baier,FOXNEWSW,"FOX News",SF/Oakland/SJ,cable,Special_Report_With_Bret_Baier,"10/20/2016 22:40:56",3634.8,2456.6,16,https://archive.org/details/FOXNEWSW_20161020_220000_Special_Report_With_Bret_Baier#start/2456.6/end/2472.6,"FOUNDATION, WHY ISN'T IT WHAT MR. TRUMP CALLS, PAY TO PLAY. >> WELL, EVERYTHING I DID AS SECRETARY OF STATE WAS FURTHERANCE OF OUR COUNTRY'S INTERESTS AND OUR VALUES. STATE DEPARTMENT HAS SAID THAT, I THINK THAT'S BEEN PROVEN, BUT I AM HAPPY, IN FACT I AM THRILLED TO TALK ABOUT THE"
KQED_20161020_010000_PBS_NewsHour_Debates_2016_A_Special_Report,FOXNEWSW_20161020_220000_Special_Report_With_Bret_Baier,FOXNEWSW,"FOX News",SF/Oakland/SJ,cable,Special_Report_With_Bret_Baier,"10/20/2016 22:41:14",3676.9,2474.6,17.4,https://archive.org/details/FOXNEWSW_20161020_220000_Special_Report_With_Bret_Baier#start/2474.6/end/2492,"-- >> SECRETARY CLINTON -- WITH THE HEALTH ASSOCIATION WE'VE MADE ENVIRONMENTS IN SCHOOLS -- >> SECRETARY CLINTON -- RESPECTFULLY THIS IS AN OPEN DISCUSSION -- >> IT IS AN OPEN DISCUSSION. >> SPECIFIC QUESTION TO PAY FOR PRAY. >> IT'S BEEN VERY WELL -- LET'S LET -- >> IT'S BEEN VERY WELL --"
KQED_20161020_010000_PBS_NewsHour_Debates_2016_A_Special_Report,FOXNEWSW_20161020_220000_Special_Report_With_Bret_Baier,FOXNEWSW,"FOX News",SF/Oakland/SJ,cable,Special_Report_With_Bret_Baier,"10/20/2016 22:06:00",4109.7,360.9,2.6,https://archive.org/details/FOXNEWSW_20161020_220000_Special_Report_With_Bret_Baier#start/360.9/end/363.5,"COMES TOGETHER IN PART FOR THE GOOD OF THE COUNTRY. ARE YOU SAYING YOU'RE NOT"
KQED_20161020_010000_PBS_NewsHour_Debates_2016_A_Special_Report,FOXNEWSW_20161020_220000_Special_Report_With_Bret_Baier,FOXNEWSW,"FOX News",SF/Oakland/SJ,cable,Special_Report_With_Bret_Baier,"10/20/2016 22:07:11",4191.1,431.6,2.5,https://archive.org/details/FOXNEWSW_20161020_220000_Special_Report_With_Bret_Baier#start/431.6/end/434.1,"DAY WHEN YOU'RE WHINING --"
KQED_20161020_010000_PBS_NewsHour_Debates_2016_A_Special_Report,FOXNEWSW_20161020_220000_Special_Report_With_Bret_Baier,FOXNEWSW,"FOX News",SF/Oakland/SJ,cable,Special_Report_With_Bret_Baier,"10/20/2016 22:07:20",5486.1,440.1,2.6,https://archive.org/details/FOXNEWSW_20161020_220000_Special_Report_With_Bret_Baier#start/440.1/end/442.7,"PREMIUMS ARE GOING UP 60 70"
KQED_20161020_010000_PBS_NewsHour_Debates_2016_A_Special_Report,BLOOMBERG_20161020_230000_Charlie_Rose,BLOOMBERG,Bloomberg,SF/Oakland/SJ,cable,Charlie_Rose,"10/20/2016 23:01:02",1087,62.1,19.5,https://archive.org/details/BLOOMBERG_20161020_230000_Charlie_Rose#start/62.1/end/81.6,"DECISIONS FOR FAMILIES TO MAKE. I HAVE MET WITH WOMEN WHO TOWARD THE END OF THEIR PREGNANCY GET THE WORST NEWS ONE COULD GET THAT THEIR HEALTH IS IN JEOPARDY IF THEY CONTINUE TO CARRY TO TERM. OR THAT SOMETHING TERRIBLE HAS HAPPENED OR JUST BEEN DISCOVERED ABOUT THE PREGNANCY. I DO NOT THINK UNITED STATES"
KQED_20161020_010000_PBS_NewsHour_Debates_2016_A_Special_Report,BLOOMBERG_20161020_230000_Charlie_Rose,BLOOMBERG,Bloomberg,SF/Oakland/SJ,cable,Charlie_Rose,"10/20/2016 23:01:23",1120.9,83.4,18,https://archive.org/details/BLOOMBERG_20161020_230000_Charlie_Rose#start/83.4/end/101.4,"PARTICULARLY ON THIS ISSUE OF LATE-TERM PER SHALL BIRTH -- >> I THINK IT'S TERRIBLE IF YOU GO WITH WHAT HILLARY IS SAYING IN THE 9th MONTH YOU CAN TAKE THE BABY AND RIP THE BABY OUT OF THE WOMB OF THE MOTHER JUST PRIOR TO THE BIRTH OF THE BABY. NOW, YOU CAN SAY THAT THAT'S"
KQED_20161020_010000_PBS_NewsHour_Debates_2016_A_Special_Report,BLOOMBERG_20161020_230000_Charlie_Rose,BLOOMBERG,Bloomberg,SF/Oakland/SJ,cable,Charlie_Rose,"10/20/2016 23:01:44",1578.3,104.4,23.3,https://archive.org/details/BLOOMBERG_20161020_230000_Charlie_Rose#start/104.4/end/127.7,"DEAL WITH IMMIGRANTS. NOW, WHAT I AM ALSO ARGUING IS THAT BRINGING UNDOCUMENTED IMMIGRANTS OUT FROM THE SHADOWS PUTTING THEM INTO THE ECONOMY WILL BE GOOD, THEN EMPLOYERS CAN'T EXPLOIT THEM AND UNDERCUT AMERICAN WAGES DONALD KNOWS A LOT ABOUT THIS HE USED UDOCUMENTED LABOR TO BUILD THE TRUMP TOWER. HE UNDERPAID UNDOCUMENTED"
KQED_20161020_010000_PBS_NewsHour_Debates_2016_A_Special_Report,BLOOMBERG_20161020_230000_Charlie_Rose,BLOOMBERG,Bloomberg,SF/Oakland/SJ,cable,Charlie_Rose,"10/20/2016 23:02:10",1884.1,130.6,20.2,https://archive.org/details/BLOOMBERG_20161020_230000_Charlie_Rose#start/130.6/end/150.8,"PLAYING CHICKEN. LOOK PUTIN FROM EVERYTHING I SEE HAVE 240 RESPECT FOR THIS PERSON. >> THAT'S BECAUSE HE'D RATHER HAVE A PUPPET AS PRESIDENT. >> NO PUPPET. >> IT'S PRETTY CLEAR -- YOU'RE THE PUPPET. >> IT'S CLEAR YOU WON'T ADMIT -- >>  YOU'RE THE PUPPET. >> RUSSIANS HAVE ENGAGED IN"
KQED_20161020_010000_PBS_NewsHour_Debates_2016_A_Special_Report,MSNBCW_20161021_000000_All_In_With_Chris_Hayes,MSNBCW,MSNBC,SF/Oakland/SJ,cable,All_In_With_Chris_Hayes,"10/21/2016 00:19:30",1101.5,1170.7,5.2,https://archive.org/details/MSNBCW_20161021_000000_All_In_With_Chris_Hayes#start/1170.7/end/1175.9,"HAPPENED OR JUST BEEN DISCOVERED ABOUT THE PREGNANCY. I DO NOT THINK UNITED STATES"
KQED_20161020_010000_PBS_NewsHour_Debates_2016_A_Special_Report,MSNBCW_20161021_000000_All_In_With_Chris_Hayes,MSNBCW,MSNBC,SF/Oakland/SJ,cable,All_In_With_Chris_Hayes,"10/21/2016 00:19:44",1152,1184.5,14.2,https://archive.org/details/MSNBCW_20161021_000000_All_In_With_Chris_Hayes#start/1184.5/end/1198.7,"BABY OUT OF THE WOMB. IN THE 9th MONTH. ON THE FINAL DAY. THAT'S NOT ACCEPTABLE. >> THAT IS NOT WHAT HAPPENS IN THESE CASES. USING THAT KIND OF SCARE RHETORIC IS JUST TERRIBLY UNFORTUNATE."
KQED_20161020_010000_PBS_NewsHour_Debates_2016_A_Special_Report,MSNBCW_20161021_000000_All_In_With_Chris_Hayes,MSNBCW,MSNBC,SF/Oakland/SJ,cable,All_In_With_Chris_Hayes,"10/21/2016 00:19:59",1180.9,1199.9,18.6,https://archive.org/details/MSNBCW_20161021_000000_All_In_With_Chris_Hayes#start/1199.9/end/1218.5,"I'VE HAD THE GREAT HONOR OF TRAVELING ACROSS THE WORLD ON BEHALF OF OUR COUNTRY, I'VE BEEN TO COUNTRIES WHERE GOVERNMENT HAVE EITHER FORCED WOMEN TO HAVE ABORTIONS LIKE THEY USED TO DO IN CHINA OR FORCED WOMEN TO BEAR CHILDREN LIKE THEY USED TO DO IN ROMANIA. I CAN TELL YOU THE GOVERNMENT HAS NO BUSINESS IN THAT DECISION"
KQED_20161020_010000_PBS_NewsHour_Debates_2016_A_Special_Report,MSNBCW_20161021_000000_All_In_With_Chris_Hayes,MSNBCW,MSNBC,SF/Oakland/SJ,cable,All_In_With_Chris_Hayes,"10/21/2016 00:31:46",1883.4,1906.1,12.7,https://archive.org/details/MSNBCW_20161021_000000_All_In_With_Chris_Hayes#start/1906.1/end/1918.8,"PLAYING CHICKEN. LOOK PUTIN FROM EVERYTHING I SEE HAVE 240 RESPECT FOR THIS PERSON. >> THAT'S BECAUSE HE'D RATHER HAVE A PUPPET AS PRESIDENT. >> NO PUPPET."
KQED_20161020_010000_PBS_NewsHour_Debates_2016_A_Special_Report,MSNBCW_20161021_000000_All_In_With_Chris_Hayes,MSNBCW,MSNBC,SF/Oakland/SJ,cable,All_In_With_Chris_Hayes,"10/21/2016 00:03:11",4001.6,191.4,5.9,https://archive.org/details/MSNBCW_20161021_000000_All_In_With_Chris_Hayes#start/191.4/end/197.3,"I WOULDN'T ASK YOU HERE ON THIS STAGE TONIGHT, DO YOU MAKE THE SAME COMMITMENT THAT YOU WILL"
KQED_20161020_010000_PBS_NewsHour_Debates_2016_A_Special_Report,MSNBCW_20161021_000000_All_In_With_Chris_Hayes,MSNBCW,MSNBC,SF/Oakland/SJ,cable,All_In_With_Chris_Hayes,"10/21/2016 00:00:17",4108.2,17.5,5.1,https://archive.org/details/MSNBCW_20161021_000000_All_In_With_Chris_Hayes#start/17.5/end/22.6,"COMES TOGETHER IN PART FOR THE GOOD OF THE COUNTRY. ARE YOU SAYING YOU'RE NOT"
KQED_20161020_010000_PBS_NewsHour_Debates_2016_A_Special_Report,MSNBCW_20161021_000000_All_In_With_Chris_Hayes,MSNBCW,MSNBC,SF/Oakland/SJ,cable,All_In_With_Chris_Hayes,"10/21/2016 00:18:38",5535,1118.6,9.3,https://archive.org/details/MSNBCW_20161021_000000_All_In_With_Chris_Hayes#start/1118.6/end/1127.9,"COMMITMENT TO RAISE TAXES ON THE WEALTHY. MY SOCIAL SECURITY PAYROLL CONTRIBUTION WILL GO UP AS WILL DONALD'S ASSUMING HE CAN'T"
KQED_20161020_010000_PBS_NewsHour_Debates_2016_A_Special_Report,CNBC_20161020_090000_Worldwide_Exchange,CNBC,CNBC,SF/Oakland/SJ,cable,Worldwide_Exchange,"10/20/2016 09:12:06",1101.5,726.3,2.3,https://archive.org/details/CNBC_20161020_090000_Worldwide_Exchange#start/726.3/end/728.6,"HAPPENED OR JUST BEEN DISCOVERED"
KQED_20161020_010000_PBS_NewsHour_Debates_2016_A_Special_Report,CNBC_20161020_090000_Worldwide_Exchange,CNBC,CNBC,SF/Oakland/SJ,cable,Worldwide_Exchange,"10/20/2016 09:14:49",1617.7,889.2,8.8,https://archive.org/details/CNBC_20161020_090000_Worldwide_Exchange#start/889.2/end/898,">> MR. TRUMP? >> PRESIDENT OBAMA HAS MOVED MILLIONS OF PEOPLE OUT. NOBODY KNOWS ABOUT IT, NOBODY TALKS ABOUT IT. BUT UNDER OBAMA MILLIONS OF PEOPLE HAVE BEEN MOVED OUT OF THIS COUNTRY."
KQED_20161020_010000_PBS_NewsHour_Debates_2016_A_Special_Report,CNBC_20161020_090000_Worldwide_Exchange,CNBC,CNBC,SF/Oakland/SJ,cable,Worldwide_Exchange,"10/20/2016 09:12:29",1742.5,749.1,4.6,https://archive.org/details/CNBC_20161020_090000_Worldwide_Exchange#start/749.1/end/753.7,"QUOTING FROM WIKILEAKS WHAT IS REALLY IMPORTANT ABOUT WIKILEAKSS IS THAT THE RUSSIAN"
KQED_20161020_010000_PBS_NewsHour_Debates_2016_A_Special_Report,CNBC_20161020_090000_Worldwide_Exchange,CNBC,CNBC,SF/Oakland/SJ,cable,Worldwide_Exchange,"10/20/2016 09:12:17",1889,737.4,3.3,https://archive.org/details/CNBC_20161020_090000_Worldwide_Exchange#start/737.4/end/740.7,"SEE HAVE 240 RESPECT FOR THIS"
KQED_20161020_010000_PBS_NewsHour_Debates_2016_A_Special_Report,CNBC_20161020_090000_Worldwide_Exchange,CNBC,CNBC,SF/Oakland/SJ,cable,Worldwide_Exchange,"10/20/2016 09:12:55",3894.9,775.3,3.9,https://archive.org/details/CNBC_20161020_090000_Worldwide_Exchange#start/775.3/end/779.2,"IMMIGRANTS IN OUR COUNTRY ACTUALLY PAY FEDERAL INCOME TAX."
KQED_20161020_010000_PBS_NewsHour_Debates_2016_A_Special_Report,CNBC_20161020_090000_Worldwide_Exchange,CNBC,CNBC,SF/Oakland/SJ,cable,Worldwide_Exchange,"10/20/2016 09:35:04",4079,2104.6,34.6,https://archive.org/details/CNBC_20161020_090000_Worldwide_Exchange#start/2104.6/end/2139.2,"IT'S RIGGED. BECAUSE SHE SHOULD NEVER -- CHRIS, SHE SHOULD NEVER HAVE BEEN ALLOWED TO RUN FOR THE PRESIDENCY BASED ON WHAT SHE DID WITH E-MAILS AND SO MANY OTHER THINGS. >> BUT SIR THERE IS TRADITION IN THIS COUNTRY IN FACT ONE OF THE PRIDES OF THIS COUNTRY IS THAT PEACEFUL TRANSITION OF POWER AND THAT NO MATTER HOW HARD FOUGHT A CAMPAIGN IS THAT THE END OF THE CAMPAIGN, THAT THE LOSER CONCEDES TO THE WINNER, NOT SAYING THAT YOU'RE NECESSARILY GOING TO BE THE LOSER OR THE WINNER. BUILT THAT THE LOSER CONCEDES TO THE WINNER AND THAT THE COUNTRY COMES TOGETHER IN PART FOR THE GOOD OF THE COUNTRY. ARE YOU SAYING YOU'RE NOT"
KQED_20161020_010000_PBS_NewsHour_Debates_2016_A_Special_Report,CNBC_20161020_090000_Worldwide_Exchange,CNBC,CNBC,SF/Oakland/SJ,cable,Worldwide_Exchange,"10/20/2016 09:12:45",4457.9,765.2,4.2,https://archive.org/details/CNBC_20161020_090000_Worldwide_Exchange#start/765.2/end/769.4,"AGAIN. YOU KNOW WHAT THE BIG WINNER IN MOSUL IS GOING TO BE AFTER WE EVENTUALLY GET IT."
KQED_20161020_010000_PBS_NewsHour_Debates_2016_A_Special_Report,MSNBCW_20161021_020000_The_Last_Word_With_Lawrence_ODonnell,MSNBCW,MSNBC,SF/Oakland/SJ,cable,The_Last_Word_With_Lawrence_ODonnell,"10/21/2016 02:52:17",1127.2,3137.9,21.4,https://archive.org/details/MSNBCW_20161021_020000_The_Last_Word_With_Lawrence_ODonnell#start/3137.9/end/3159.3,"IN THE 9th MONTH YOU CAN TAKE THE BABY AND RIP THE BABY OUT OF THE WOMB OF THE MOTHER JUST PRIOR TO THE BIRTH OF THE BABY. NOW, YOU CAN SAY THAT THAT'S OKAY AND HILLARY CAN SAY THAT THAT'S OKAY. BUT IT'S NOT OKAY WITH ME. BECAUSE BASED ON WHAT SHE IS SAYING BASED ON WHERE SHE'S GOING AND WHERE SHE'S BEEN, YOU"
KQED_20161020_010000_PBS_NewsHour_Debates_2016_A_Special_Report,MSNBCW_20161021_020000_The_Last_Word_With_Lawrence_ODonnell,MSNBCW,MSNBC,SF/Oakland/SJ,cable,The_Last_Word_With_Lawrence_ODonnell,"10/21/2016 02:32:46",1783.1,1966.5,8.3,https://archive.org/details/MSNBCW_20161021_020000_The_Last_Word_With_Lawrence_ODonnell#start/1966.5/end/1974.8,"EVENING, CHRIS, IS FINALLY WILL DONALD TRUMP ADMIT AND CONDEMN THAT THE RUSSIANS ARE DOING THIS. AND MAKE IT CLEAR THAT HE WILL"
KQED_20161020_010000_PBS_NewsHour_Debates_2016_A_Special_Report,MSNBCW_20161021_020000_The_Last_Word_With_Lawrence_ODonnell,MSNBCW,MSNBC,SF/Oakland/SJ,cable,The_Last_Word_With_Lawrence_ODonnell,"10/21/2016 02:32:57",1883.4,1977.4,12.6,https://archive.org/details/MSNBCW_20161021_020000_The_Last_Word_With_Lawrence_ODonnell#start/1977.4/end/1990,"PLAYING CHICKEN. LOOK PUTIN FROM EVERYTHING I SEE HAVE 240 RESPECT FOR THIS PERSON. >> THAT'S BECAUSE HE'D RATHER HAVE A PUPPET AS PRESIDENT. >> NO PUPPET."
KQED_20161020_010000_PBS_NewsHour_Debates_2016_A_Special_Report,MSNBCW_20161021_020000_The_Last_Word_With_Lawrence_ODonnell,MSNBCW,MSNBC,SF/Oakland/SJ,cable,The_Last_Word_With_Lawrence_ODonnell,"10/21/2016 02:33:39",1935.4,2019.3,37.7,https://archive.org/details/MSNBCW_20161021_020000_The_Last_Word_With_Lawrence_ODonnell#start/2019.3/end/2057,"TRYING TO INTERFERE IN OUR ELECTION. WE HAVE 17 INTELLIGENCE AGENCIES AGENCIES, CIVILIAN AND MILITARY WHO HAVE ALL CONCLUDED THAT THESE ESPIONAGE ATTACKS, THESE CYBERATTACKS COME FROM THE HIGHEST LEVELS OF THE KREMLIN AND THEY ARE DESIGNED TO INFLUENCE OUR ELECTION. I FIND THAT DEEPLY DISTURBING. >> SECRETARY CLINTON -- I HIT IT'S -- SHE HAS NO IDEA WHETHER IT'S RUSHA CHINA -- >> I'M NOT QUOTING MYSELF I AM -- >> YOU HAVE NO IDEA. >> -- DO YOU DOUBT 17 INTELLIGENCE -- >> HAVE NO IDEA. >> WELL, YOU HAVE -- VLADIMIR"
